{"schema_version":"1.0","project_id":"fixture-demo","revision":1,"status":"ready","topic":"synthetic framework demonstration","objectives":["exercise fixture workflow"],"languages":{"conversation":"en","search":["en"],"reports":["zh","en","ja"],"timezone":"UTC"},"scope":{"document_types":["paper"],"sources":["fixture"],"publication_date_from":null,"patent_jurisdictions":[]},"reference_library":{"collection_ids":["baseline"],"document_ids":[],"freeze_each_run":true,"promotion":"explicit_only"},"criteria":[],"inclusion_rules":[],"exclusion_rules":[],"execution":{"trigger":"manual","missing_evidence":"watch_and_queue","budget":{"max_candidates":50,"max_queries_per_source":3,"max_search_rounds":2,"max_model_calls":120,"max_concurrency":1,"max_active_minutes":30,"max_file_mib":30,"max_total_download_mib":300,"max_estimated_cost_usd":null,"on_limit":"save_partial_report"}},"data_policy":{"original_storage":"local","embedding":"local","cloud_excerpt_allowed":true,"llm_context":"relevant_excerpts"},"human_review":{"enabled":true,"scope":"individual_by_default","global_rule_updates":"explicit_only"},"report":{"formats":["html","markdown","json"],"review_export":"csv","include_technical_map":true,"include_cumulative_review":true},"unresolved_questions":[]}
